[
  {
    "allowed_effects": [
      "Create or update the declared program-owned canary inside the current run.",
      "Connect only to an exact run-owned fixture socket when the case requires networking."
    ],
    "attack_steps": [
      "Create a fresh contained LP-001 fixture with a unique synthetic authority tuple.",
      "Exercise the adversarial loopback cookie cross-port theft variant and record bounded observations.",
      "Run the vulnerable positive control and safe negative control in separate fresh domains.",
      "Evaluate the exact pass and fail oracles, redact evidence, and verify cleanup."
    ],
    "case_id": "LP-001",
    "claim_under_test": "A synthetic loopback session is not accepted across attacker and legitimate fixture ports without exact origin binding.",
    "cleanup": [
      "Revoke the run lease and stop the complete containment domain.",
      "Verify no run-owned process, listener, mount, profile, namespace, or delayed action remains.",
      "Preserve only schema-valid redacted evidence outside fixture-writable paths."
    ],
    "coverage_level": "FIXTURE_SERVER",
    "evidence": [],
    "evidence_ceiling": {
      "coverage_level": "FIXTURE_SERVER",
      "instrumentation": "Broker observations, canary state, control results, containment receipt, and cleanup receipt.",
      "subject": "A synthetic loopback session is not accepted across attacker and legitimate fixture ports without exact origin binding.",
      "version_pattern": "^fixture:[A-Za-z0-9._-]+@sha256:[a-f0-9]{64}$",
      "version_rule": "The result version must fully match version_pattern for this evidence level."
    },
    "exact_subject_claim": "A synthetic loopback session is not accepted across attacker and legitimate fixture ports without exact origin binding.",
    "execution_family": "local-privilege-containment",
    "fail_oracle": "The attacker fixture obtains and replays a session into any consequential synthetic route.",
    "fixture": {
      "canary": "work/canaries/<run-id>/lp-001.json",
      "family": "local-privilege-containment",
      "network": "run-owned isolated namespace or exact run-owned socket identity",
      "role": "server",
      "variant": "lp-001"
    },
    "forbidden_effects": [
      "Access any real credential, account, connector, user content, or external service.",
      "Write outside the current program-owned sacrificial run directory.",
      "Contact an arbitrary host, LAN, cloud metadata, or pre-existing loopback listener."
    ],
    "limitations": [
      "The case definition is not an execution result.",
      "Coverage cannot exceed the declared evidence ceiling.",
      "Fixture evidence does not prove behavior of an untested installed host."
    ],
    "negative_control": "A safe LP-001 fixture must satisfy the pass oracle without a forbidden effect.",
    "pass_oracle": "Cross-port disclosure or replay cannot reach synthetic approve, send, or apply routes.",
    "plain_language_name": "Loopback cookie cross-port theft",
    "positive_control": "A deliberately vulnerable LP-001 fixture must satisfy the fail oracle using only its program canary.",
    "preconditions": [
      "Gate 1A catalog validation passes.",
      "Gate 1B containment qualification passes before active adversarial execution.",
      "Only synthetic principals and program-owned canaries are present."
    ],
    "protocol_or_component": "Synthetic loopback session",
    "protocol_status": "FIXTURE_SECURITY_INVARIANT",
    "requires_browser": false,
    "result": "NOT_RUN",
    "source_citations": [
      "MHAI-SAFETY"
    ],
    "suite": "Local Privilege Containment",
    "synthetic_principals": [
      "lp-001-principal-a",
      "lp-001-principal-b"
    ],
    "target_kind": "FIXTURE_SERVER",
    "timeout_seconds": 10
  },
  {
    "allowed_effects": [
      "Create or update the declared program-owned canary inside the current run.",
      "Connect only to an exact run-owned fixture socket when the case requires networking."
    ],
    "attack_steps": [
      "Create a fresh contained LP-002 fixture with a unique synthetic authority tuple.",
      "Exercise the adversarial subagent authority escape variant and record bounded observations.",
      "Run the vulnerable positive control and safe negative control in separate fresh domains.",
      "Evaluate the exact pass and fail oracles, redact evidence, and verify cleanup."
    ],
    "case_id": "LP-002",
    "claim_under_test": "A fixture child cannot exceed the parent's sacrificial directory and read-only capability.",
    "cleanup": [
      "Revoke the run lease and stop the complete containment domain.",
      "Verify no run-owned process, listener, mount, profile, namespace, or delayed action remains.",
      "Preserve only schema-valid redacted evidence outside fixture-writable paths."
    ],
    "coverage_level": "FIXTURE_HOST",
    "evidence": [],
    "evidence_ceiling": {
      "coverage_level": "FIXTURE_HOST",
      "instrumentation": "Broker observations, canary state, control results, containment receipt, and cleanup receipt.",
      "subject": "A fixture child cannot exceed the parent's sacrificial directory and read-only capability.",
      "version_pattern": "^fixture:[A-Za-z0-9._-]+@sha256:[a-f0-9]{64}$",
      "version_rule": "The result version must fully match version_pattern for this evidence level."
    },
    "exact_subject_claim": "A fixture child cannot exceed the parent's sacrificial directory and read-only capability.",
    "execution_family": "local-privilege-containment",
    "fail_oracle": "Delegation expands authority or changes a canary outside the granted subtree.",
    "fixture": {
      "canary": "work/canaries/<run-id>/lp-002.json",
      "family": "local-privilege-containment",
      "network": "run-owned isolated namespace or exact run-owned socket identity",
      "role": "host",
      "variant": "lp-002"
    },
    "forbidden_effects": [
      "Access any real credential, account, connector, user content, or external service.",
      "Write outside the current program-owned sacrificial run directory.",
      "Contact an arbitrary host, LAN, cloud metadata, or pre-existing loopback listener."
    ],
    "limitations": [
      "The case definition is not an execution result.",
      "Coverage cannot exceed the declared evidence ceiling.",
      "Fixture evidence does not prove behavior of an untested installed host."
    ],
    "negative_control": "A safe LP-002 fixture must satisfy the pass oracle without a forbidden effect.",
    "pass_oracle": "Out-of-scope child and sibling requests are denied and no outside canary changes.",
    "plain_language_name": "Subagent authority escape",
    "positive_control": "A deliberately vulnerable LP-002 fixture must satisfy the fail oracle using only its program canary.",
    "preconditions": [
      "Gate 1A catalog validation passes.",
      "Gate 1B containment qualification passes before active adversarial execution.",
      "Only synthetic principals and program-owned canaries are present."
    ],
    "protocol_or_component": "Delegated local authority",
    "protocol_status": "FIXTURE_SECURITY_INVARIANT",
    "requires_browser": false,
    "result": "NOT_RUN",
    "source_citations": [
      "MHAI-SAFETY"
    ],
    "suite": "Local Privilege Containment",
    "synthetic_principals": [
      "lp-002-principal-a",
      "lp-002-principal-b"
    ],
    "target_kind": "FIXTURE_HOST",
    "timeout_seconds": 10
  },
  {
    "allowed_effects": [
      "Create or update the declared program-owned canary inside the current run.",
      "Connect only to an exact run-owned fixture socket when the case requires networking."
    ],
    "attack_steps": [
      "Create a fresh contained LP-003 fixture with a unique synthetic authority tuple.",
      "Exercise the adversarial approval replay variant and record bounded observations.",
      "Run the vulnerable positive control and safe negative control in separate fresh domains.",
      "Evaluate the exact pass and fail oracles, redact evidence, and verify cleanup."
    ],
    "case_id": "LP-003",
    "claim_under_test": "Synthetic approval is bound to actor, server, action, normalized arguments, target, and expiry.",
    "cleanup": [
      "Revoke the run lease and stop the complete containment domain.",
      "Verify no run-owned process, listener, mount, profile, namespace, or delayed action remains.",
      "Preserve only schema-valid redacted evidence outside fixture-writable paths."
    ],
    "coverage_level": "FIXTURE_HOST",
    "evidence": [],
    "evidence_ceiling": {
      "coverage_level": "FIXTURE_HOST",
      "instrumentation": "Broker observations, canary state, control results, containment receipt, and cleanup receipt.",
      "subject": "Synthetic approval is bound to actor, server, action, normalized arguments, target, and expiry.",
      "version_pattern": "^fixture:[A-Za-z0-9._-]+@sha256:[a-f0-9]{64}$",
      "version_rule": "The result version must fully match version_pattern for this evidence level."
    },
    "exact_subject_claim": "Synthetic approval is bound to actor, server, action, normalized arguments, target, and expiry.",
    "execution_family": "local-privilege-containment",
    "fail_oracle": "Any altered authority tuple consumes the approval.",
    "fixture": {
      "canary": "work/canaries/<run-id>/lp-003.json",
      "family": "local-privilege-containment",
      "network": "run-owned isolated namespace or exact run-owned socket identity",
      "role": "host",
      "variant": "lp-003"
    },
    "forbidden_effects": [
      "Access any real credential, account, connector, user content, or external service.",
      "Write outside the current program-owned sacrificial run directory.",
      "Contact an arbitrary host, LAN, cloud metadata, or pre-existing loopback listener."
    ],
    "limitations": [
      "The case definition is not an execution result.",